<?xml version="1.0" encoding="UTF-8"?>
<Type_0x08 messageNo="0" messageSequenceNo="0"
	messageSerialNo="0" xmlns="http://www.example.org/msg_0x08" xmlns:u="http://www.example.org/UType"
	xmlns:xsi="http://www.w3.org/2001/XMLSchema-instance"
	xsi:schemaLocation="http://www.example.org/msg_0x08 ../xsd/msg_0x08.xsd ">
	<R_StartTime>0</R_StartTime>
	<R_EndTime>0</R_EndTime>
	<AppType>0</AppType>
	<AppID>0</AppID>
	<AppName>AppName</AppName>
	<UserType>0</UserType>
	<MessageSerialNo>0</MessageSerialNo>
</Type_0x08>
